<?xml version="1.0" encoding="UTF-8"?>
<edgarSubmission xsi:schemaLocation="http://www.sec.gov/edgar/thirteenffiler eis_13F_Filer.xsd" xmlns="http://www.sec.gov/edgar/thirteenffiler" xmlns:ns1="http://www.sec.gov/edgar/common" xmlns:xsi="http://www.w3.org/2001/XMLSchema-instance">
  <schemaVersion>X0202</schemaVersion>
  <headerData>
    <submissionType>13F-HR/A</submissionType>
    <filerInfo>
      <liveTestFlag>LIVE</liveTestFlag>
      <flags>
        <confirmingCopyFlag>false</confirmingCopyFlag>
        <returnCopyFlag>false</returnCopyFlag>
        <overrideInternetFlag>false</overrideInternetFlag>
      </flags>
      <filer>
        <credentials>
          <cik>0001732811</cik>
          <ccc>XXXXXXXX</ccc>
        </credentials>
      </filer>
      <periodOfReport>12-31-2025</periodOfReport>
    </filerInfo>
  </headerData>
  <formData>
    <coverPage>
      <reportCalendarOrQuarter>12-31-2025</reportCalendarOrQuarter>
      <isAmendment>true</isAmendment>
      <amendmentNo>1</amendmentNo>
      <amendmentInfo>
        <amendmentType>NEW HOLDINGS</amendmentType>
        <confDeniedExpired>false</confDeniedExpired>
      </amendmentInfo>
      <filingManager>
        <name>MFN Partners Management, LP</name>
        <address>
          <ns1:street1>222 BERKELEY STREET, 13TH FLOOR</ns1:street1>
          <ns1:city>BOSTON</ns1:city>
          <ns1:stateOrCountry>MA</ns1:stateOrCountry>
          <ns1:zipCode>02116</ns1:zipCode>
        </address>
      </filingManager>
      <reportType>13F HOLDINGS REPORT</reportType>
      <form13FFileNumber>028-19231</form13FFileNumber>
      <crdNumber>000291755</crdNumber>
      <secFileNumber>801-112441</secFileNumber>
      <provideInfoForInstruction5>N</provideInfoForInstruction5>
    </coverPage>
    <signatureBlock>
      <name>Jon Reisman</name>
      <title>Chief Compliance Officer</title>
      <phone>617-443-2040</phone>
      <signature>/s/ Jon Reisman</signature>
      <city>Boston</city>
      <stateOrCountry>MA</stateOrCountry>
      <signatureDate>04-29-2026</signatureDate>
    </signatureBlock>
    <summaryPage>
      <otherIncludedManagersCount>0</otherIncludedManagersCount>
      <tableEntryTotal>2</tableEntryTotal>
      <tableValueTotal>24920000</tableValueTotal>
    </summaryPage>
  </formData>
</edgarSubmission>